<?xml version="1.0" encoding="UTF-8"?>
<!DOCTYPE FlameDataLoad SYSTEM "../../StandardX01.dtd">
<FlameDataLoad loader="xw.action.ActionDataLoader" description="Equipment">

	<LoadObject type="xw.action.entity.XActionItem" where="type,name">
		<attr name="name">newEquiptInstance</attr>
		<attr name="type">XEquiptInstance</attr>
		<attr name="display">New</attr>
		<attr name="style"></attr>
		<attr name="icon">images/add16x16.gif</attr>
		<attr name="url">thymeleaf/mes/equipt/newEquiptInstance.html</attr>
		<attr name="processor">mes.apl.processor.CreateEquiptInstanceProcessor</attr>
		<attr name="winType">popup</attr>
		<attr name="style">width:680px;height:380px;padding:5px;</attr>
		<attr name="en_US">Remove</attr>
		<attr name="zh_CN">删除</attr>
	</LoadObject>
	<LoadObject type="xw.action.entity.XActionItem" where="type,name">
		<attr name="name">push2EquiptMachine</attr>
		<attr name="type">XEquiptInstance</attr>
		<attr name="display">推送</attr>
		<attr name="style"></attr>
		<attr name="icon">images/alert.png</attr>
		<attr name="processor">mes.apl.processor.PushEquiptInstanceProcessor</attr>
		<attr name="winType">invoke</attr>
		<attr name="style">width:680px;height:380px;padding:5px;</attr>
		<attr name="beforeJS">return xworx.validateSelect(p, true);</attr>
		<attr name="afterJS"></attr>
		<attr name="en_US">Push Equiptment</attr>
		<attr name="zh_CN">推送设备</attr>
	</LoadObject>
	<LoadObject type="xw.action.entity.XActionModel" where="type,name">
		<attr name="name">EquiptInstance-Toolbar</attr>
		<attr name="type">XEquiptInstance</attr>
		<attr name="display">EquiptInstance Toolbar</attr>
		<attr name="icon">images/part.png</attr>
		<attr name="style">dropdown-toggle</attr>
		<link type="xw.action.entity.XActionItemLink" refer="left">
			<attr name="sort">10</attr>
			<where type="xw.action.entity.XActionItem" refer="right">
				<attr name="name">newEquiptInstance</attr>
				<attr name="type">XEquiptInstance</attr>
			</where>
		</link>
		<link type="xw.action.entity.XActionItemLink" refer="left">
			<attr name="sort">40</attr>
			<where type="xw.action.entity.XActionItem" refer="right">
				<attr name="name">delete</attr>
				<attr name="type">XObject</attr>
			</where>
		</link>
		<link type="xw.action.entity.XActionItemLink" refer="left">
			<attr name="sort">50</attr>
			<where type="xw.action.entity.XActionItem" refer="right">
				<attr name="name">push2EquiptMachine</attr>
				<attr name="type">XEquiptInstance</attr>
			</where>
		</link>
	</LoadObject>

	<LoadObject type="xw.action.entity.XActionItem" where="type,name">
		<attr name="name">newEquiptParameter</attr>
		<attr name="type">XEquiptInstance</attr>
		<attr name="display">新建</attr>
		<attr name="style"></attr>
		<attr name="icon">images/add16x16.gif</attr>
		<attr name="url">thymeleaf/mes/equipt/newEquiptParameter.html</attr>
		<attr name="processor">mes.equipt.processor.CreateEquiptParameterProcessor</attr>
		<attr name="winType">popup</attr>
		<attr name="style">width:680px;height:380px;padding:5px;</attr>
		<attr name="beforeJS"></attr>
		<attr name="afterJS"></attr>
		<attr name="en_US">New</attr>
		<attr name="zh_CN">新建</attr>
	</LoadObject>
	<LoadObject type="xw.action.entity.XActionItem" where="type,name">
		<attr name="name">editEquiptParameter</attr>
		<attr name="type">XEquiptInstance</attr>
		<attr name="display">编辑</attr>
		<attr name="style"></attr>
		<attr name="icon">images/edit.gif</attr>
		<attr name="url">thymeleaf/mes/equipt/editEquiptParameter.html</attr>
		<attr name="processor">mes.equipt.processor.EditEquiptParameterProcessor</attr>
		<attr name="winType">popup</attr>
		<attr name="style">width:680px;height:380px;padding:5px;</attr>
		<attr name="beforeJS">return xworx.validateSelect(p, true);</attr>
		<attr name="afterJS"></attr>
		<attr name="en_US">Edit</attr>
		<attr name="zh_CN">编辑</attr>
	</LoadObject>
	<LoadObject type="xw.action.entity.XActionItem" where="type,name">
		<attr name="name">setParameterValue</attr>
		<attr name="type">XEquiptInstance</attr>
		<attr name="display">设值</attr>
		<attr name="style"></attr>
		<attr name="icon">images/values.png</attr>
		<attr name="url">thymeleaf/mes/equipt/setParameterValue.html</attr>
		<attr name="processor">mes.equipt.processor.SetParameterValueProcessor</attr>
		<attr name="winType">popup</attr>
		<attr name="style">width:680px;height:380px;padding:5px;</attr>
		<attr name="beforeJS">return xworx.validateSelect(p, true);</attr>
		<attr name="afterJS"></attr>
		<attr name="en_US">Set Value</attr>
		<attr name="zh_CN">设置值</attr>
	</LoadObject>
	<LoadObject type="xw.action.entity.XActionItem" where="type,name">
		<attr name="name">push2Thingworx</attr>
		<attr name="type">XEquiptInstance</attr>
		<attr name="display">Push Thingworx</attr>
		<attr name="style"></attr>
		<attr name="icon">images/synchronized.gif</attr>
		<attr name="processor">mes.equipt.processor.SyncEquiptParameterProcessor</attr>
		<attr name="winType">invoke</attr>
		<attr name="beforeJS">return xworx.validateSelect(p, true);</attr>
		<attr name="afterJS"></attr>
		<attr name="en_US">Push Thingworx</attr>
		<attr name="zh_CN">同步Thingworx</attr>
	</LoadObject>
	<LoadObject type="xw.action.entity.XActionItem" where="type,name">
		<attr name="name">delete2Thingworx</attr>
		<attr name="type">XEquiptInstance</attr>
		<attr name="display">同步删除</attr>
		<attr name="style"></attr>
		<attr name="icon">images/sync-delete.png</attr>
		<attr name="processor">mes.equipt.processor.DeleteEquiptParameterProcessor</attr>
		<attr name="winType">invoke</attr>
		<attr name="beforeJS">return xworx.validateSelect(p, true);</attr>
		<attr name="afterJS"></attr>
		<attr name="en_US">Sync Remove</attr>
		<attr name="zh_CN">同步删除</attr>
	</LoadObject>
	<LoadObject type="xw.action.entity.XActionModel" where="type,name">
		<attr name="name">EquiptParameter-Toolbar</attr>
		<attr name="type">XEquiptInstance</attr>
		<attr name="display">EquiptInstance Toolbar</attr>
		<attr name="style">dropdown-toggle</attr>
		<link type="xw.action.entity.XActionItemLink" refer="left">
			<attr name="sort">10</attr>
			<where type="xw.action.entity.XActionItem" refer="right">
				<attr name="name">newEquiptParameter</attr>
				<attr name="type">XEquiptInstance</attr>
			</where>
		</link>
		<link type="xw.action.entity.XActionItemLink" refer="left">
			<attr name="sort">20</attr>
			<where type="xw.action.entity.XActionItem" refer="right">
				<attr name="name">editEquiptParameter</attr>
				<attr name="type">XEquiptInstance</attr>
			</where>
		</link>
		<link type="xw.action.entity.XActionItemLink" refer="left">
			<attr name="sort">30</attr>
			<where type="xw.action.entity.XActionItem" refer="right">
				<attr name="name">setParameterValue</attr>
				<attr name="type">XEquiptInstance</attr>
			</where>
		</link>
		<link type="xw.action.entity.XActionItemLink" refer="left">
			<attr name="sort">40</attr>
			<where type="xw.action.entity.XActionItem" refer="right">
				<attr name="name">delete</attr>
				<attr name="type">XObject</attr>
			</where>
		</link>
		<link type="xw.action.entity.XActionItemLink" refer="left">
			<attr name="sort">50</attr>
			<where type="xw.action.entity.XActionItem" refer="right">
				<attr name="name">delete2Thingworx</attr>
				<attr name="type">XEquiptInstance</attr>
			</where>
		</link>
		<link type="xw.action.entity.XActionItemLink" refer="left">
			<attr name="sort">60</attr>
			<where type="xw.action.entity.XActionItem" refer="right">
				<attr name="name">push2Thingworx</attr>
				<attr name="type">XEquiptInstance</attr>
			</where>
		</link>
	</LoadObject>
</FlameDataLoad>