<?xml version="1.0" encoding="UTF-8"?>
<!DOCTYPE FlameDataLoad SYSTEM "../../StandardX01.dtd">
<FlameDataLoad loader="com.flame.localize.EnumeratedLoader" description="EGroupType">
    <LoadObject type="plm.part.ViewRB" where="name">
        <attr name="name">Design</attr>
        <attr name="display">Design</attr>
        <attr name="en_US">Design</attr>
        <attr name="zh_CN">设计</attr>
    </LoadObject>
    <LoadObject type="plm.part.ViewRB" where="name">
        <attr name="name">Manufacture</attr>
        <attr name="display">Manufacture</attr>
        <attr name="en_US">Manufacture</attr>
        <attr name="zh_CN">制造</attr>
    </LoadObject>
</FlameDataLoad>