<?xml version="1.0" encoding="UTF-8"?>
<!DOCTYPE FlameDataLoad SYSTEM "../../StandardX01.dtd">
<FlameDataLoad loader="com.flame.localize.EnumeratedLoader" description="EGroupType">
    <LoadObject type="xw.context.entity.LibraryTypeRB" where="name">
        <attr name="name">PDM</attr>
        <attr name="display">Product Library</attr>
        <attr name="en_US">Product Library</attr>
        <attr name="zh_CN">产品库</attr>
    </LoadObject>
    <LoadObject type="xw.context.entity.LibraryTypeRB" where="name">
        <attr name="name">MES</attr>
        <attr name="display">Manufacturing Execution Library</attr>
        <attr name="en_US">Manufacturing Execution Library</attr>
        <attr name="zh_CN">制造库</attr>
    </LoadObject>
    <LoadObject type="xw.context.entity.LibraryTypeRB" where="name">
        <attr name="name">PJT</attr>
        <attr name="display">Project Library</attr>
        <attr name="en_US">Project Library</attr>
        <attr name="zh_CN">项目库</attr>
    </LoadObject>
    <LoadObject type="xw.context.entity.LibraryTypeRB" where="name">
        <attr name="name">LIB</attr>
        <attr name="display">General Library</attr>
        <attr name="en_US">General Library</attr>
        <attr name="zh_CN">通用库</attr>
    </LoadObject>
</FlameDataLoad>