<?xml version="1.0" encoding="UTF-8"?>
<!DOCTYPE FlameDataLoad SYSTEM "../../StandardX01.dtd">
<FlameDataLoad loader="xw.action.ActionDataLoader" description="XThingModel ActionMenu">
    <LoadObject type="xw.action.entity.XActionItem" where="type,name">
        <attr name="name">visibility</attr>
        <attr name="type">XPropertyDefinition</attr>
        <attr name="display">Visibility</attr>
        <attr name="style"></attr>
        <attr name="url">thymeleaf/thing/model/propertyVisibilityTab.html</attr>
        <attr name="winType">page</attr>
        <attr name="en_US">Visibility</attr>
        <attr name="zh_CN">可见性</attr>
    </LoadObject>
    <LoadObject type="xw.action.entity.XActionItem" where="type,name">
        <attr name="name">constraints</attr>
        <attr name="type">XPropertyDefinition</attr>
        <attr name="display">Diagram</attr>
        <attr name="style"></attr>
        <attr name="url">thymeleaf/thing/model/propertyConstraintsTab.html</attr>
        <attr name="winType">page</attr>
        <attr name="en_US">Constraints</attr>
        <attr name="zh_CN">约束</attr>
    </LoadObject>
    <LoadObject type="xw.action.entity.XActionModel" where="type,name"><!-- XPropertyDefinition Info Page -->
        <attr name="name">XWX-InfoTabs</attr>
        <attr name="type">XPropertyDefinition</attr>
        <attr name="display">XPropertyDefinition Tabs</attr>
        <attr name="icon">images/flow/flowinst.gif</attr>
        <attr name="style">dropdown-toggle</attr>
        <link type="xw.action.entity.XActionItemLink" refer="left">
            <attr name="sort">10</attr>
            <where type="xw.action.entity.XActionItem" refer="right">
                <attr name="name">visibility</attr>
                <attr name="type">XPropertyDefinition</attr>
            </where>
        </link>
        <link type="xw.action.entity.XActionItemLink" refer="left">
            <attr name="sort">20</attr>
            <where type="xw.action.entity.XActionItem" refer="right">
                <attr name="name">constraints</attr>
                <attr name="type">XPropertyDefinition</attr>
            </where>
        </link>
    </LoadObject>
</FlameDataLoad>