<?xml version="1.0" encoding="UTF-8"?>
<!DOCTYPE FlameDataLoad SYSTEM "../../StandardX01.dtd">
<FlameDataLoad loader="xw.action.ActionDataLoader" description="Root Model">
	<LoadObject type="xw.action.entity.XActionItem" where="type,name">
		<attr name="name">detail</attr>
		<attr name="type">XGroup</attr>
		<attr name="display">Detail</attr>
		<attr name="style"></attr>
		<attr name="url">thymeleaf/page/detailsInfo.html</attr>
		<attr name="winType">page</attr>
		<attr name="en_US">Details</attr>
		<attr name="zh_CN">详细信息</attr>
	</LoadObject>
	<LoadObject type="xw.action.entity.XActionModel" where="type,name"><!-- XPart Info Page Info Tabs -->
		<attr name="name">XWX-InfoTabs</attr>
		<attr name="type">XGroup</attr>
		<attr name="display">XGroup Tabs</attr>
		<attr name="icon">images/group.png</attr>
		<attr name="style">dropdown-toggle</attr>
		<link type="xw.action.entity.XActionItemLink" refer="left">
			<attr name="sort">10</attr>
			<where type="xw.action.entity.XActionItem" refer="right">
				<attr name="name">detail</attr>
				<attr name="type">XGroup</attr>
			</where>
		</link>
	</LoadObject>
	<LoadObject type="xw.action.entity.XActionItem" where="type,name">
		<attr name="name">detail</attr>
		<attr name="type">XUser</attr>
		<attr name="display">Detail</attr>
		<attr name="style"></attr>
		<attr name="url">thymeleaf/auths/userDetailsTab.html</attr>
		<attr name="winType">page</attr>
		<attr name="en_US">Details</attr>
		<attr name="zh_CN">详细信息</attr>
	</LoadObject>
	<LoadObject type="xw.action.entity.XActionModel" where="type,name"><!-- XPart Info Page Info Tabs -->
		<attr name="name">XWX-InfoTabs</attr>
		<attr name="type">XUser</attr>
		<attr name="display">XUser Tabs</attr>
		<attr name="icon">images/person.png</attr>
		<attr name="style">dropdown-toggle</attr>
		<link type="xw.action.entity.XActionItemLink" refer="left">
			<attr name="sort">10</attr>
			<where type="xw.action.entity.XActionItem" refer="right">
				<attr name="name">detail</attr>
				<attr name="type">XUser</attr>
			</where>
		</link>
	</LoadObject>
</FlameDataLoad>